panel_id,species,source_mode,panel_temperature_K,capture_mechanism,sticking_assumption,capacity_assumption,saturation_risk,regeneration_required,Mode_D_contamination_risk,measurement_required,validation_status,can_PASS_now
PANEL-H2,H2,"Mode A residual; Mode B byproduct",4,physisorption + cryopumping; H2 not fully captured at 4 K,"ASSUMED s ~ 0.01 at 4 K (low; literature-typical, not measured)",ASSUMED — capacity per panel area not measured,HIGH — H2 saturates 4 K panels rapidly,"YES — bakeout / warm-up cycle, or supplemental cold trap at lower T",HIGH if not captured before Mode D — H2 contributes to NV surface decoherence,"In-system RGA H2 partial pressure after Mode B+C; QCM mass uptake; coupon analysis",BLOCKED,NO
PANEL-CH4,CH4 / C-13 methane precursor,Mode B,4,physisorption on cold surface; cryocondensation below ~30-40 K,"ASSUMED s ~ 0.3-0.8 at 4 K (depends on coverage; not measured here)",ASSUMED — depends on Mode B precursor flux and panel area,MEDIUM,YES — regenerable via warm-up,HIGH — methane fragments are the dominant Mode B chemical memory species,"RGA species-resolved (m/z = 15, 16); QCM mass uptake; witness coupon Raman/XPS",BLOCKED,NO
PANEL-HC,generic hydrocarbons (C-2 and heavier),Mode B,4,cryocondensation,"ASSUMED s ~ 1.0 at 4 K for heavier hydrocarbons",ASSUMED — capacity high but coverage on sensing surface is the failure mode,LOW for capture; HIGH for migration to sensing surface,YES — bakeout,HIGH — heavy hydrocarbons on the diamond surface are catastrophic for NV ODMR,"RGA m/z > 28; coupon XPS surface composition; AFM topography",BLOCKED,NO
PANEL-H2O,H2O,"all modes — outgassing from chamber walls; Mode B byproduct of incomplete decomposition",4,cryocondensation,"ASSUMED s ~ 1.0 at 4 K","Effectively unlimited for typical loads, but Mode-D-side migration is the failure mode",LOW for capture; MEDIUM for migration,YES — bakeout,"MEDIUM — water on diamond surface affects termination chemistry, NV charge state",In-system RGA H2O background; bakeout-protocol effectiveness measurement,BLOCKED,NO
PANEL-CO,CO,"Mode B byproduct; residual atmospheric",4,cryocondensation below ~25 K,"ASSUMED s ~ 0.5-1.0 at 4 K","ASSUMED — moderate",MEDIUM,YES — regenerable,MEDIUM — CO interacts with diamond surface; less severe than hydrocarbons,RGA m/z = 28; coupon XPS,BLOCKED,NO
PANEL-CO2,CO2,Mode B byproduct,4,cryocondensation,"ASSUMED s ~ 1.0 at 4 K","ASSUMED — high",LOW for capture,YES — regenerable via warm-up,LOW-MEDIUM,RGA m/z = 44,BLOCKED,NO
PANEL-FRAG,generic Mode B process fragments,Mode B,4,mixed (cryocondensation + chemisorption),"ASSUMED s ~ 0.5 average, not measured",ASSUMED — depends on Mode B chemistry and pulse history,HIGH — heterogeneous fragments may accumulate and migrate,YES — bakeout + extended warm-up,HIGH if Mode C regeneration is incomplete; potential surface termination corruption,RGA full mass-scan; coupon XPS/Raman; AFM,BLOCKED,NO
