interface_id,interface,subsystems,intended_function,mode,required_compatibility,warm_side_anchor,cold_side_anchor,intermediate_thermal_intercepts,mechanical_attachment,thermal_path,vibration_path,contamination_path,possible_mismatch,measurement_required,status,gate_impact,failure_consequence,can_PASS_now,notes
I001,LCVD laser ↔ diamond surface,Mode B optics / diamond,fs laser pulse → carbon deposition,A,fs pulse delivery without damage; fluence << damage threshold,TBD,TBD,TBD,TBD,TBD,TBD,TBD,eta_abs UNKNOWN; damage threshold INDIRECT (literature),Transmission/reflection + pump-probe,DESIGN_SPECIFIED,"D6,D7",Thermal overload or surface damage,NO,AOM CANNOT gate 100 fs pulses. Pockels cell required.
I002,NV readout laser ↔ NV layer,Mode D optics / NV,532 nm excitation → ODMR/Ramsey,D,C_contr>0 at 10 mK under actual laser power,TBD,TBD,TBD,TBD,TBD,TBD,TBD,Charge-state instability under cryogenic laser irradiation. C_contr UNKNOWN at 10 mK.,ODMR at 10 mK; optical power sweep,DESIGN_SPECIFIED,"D12,D13",No NV signal; C_contr=0,NO,Room-T contrast does not predict 10 mK behavior
I003,Microwave CPW ↔ NV ensemble,MW delivery / NV,MW drive → Rabi oscillations for spin control,D,P_mw at CPW within thermal budget; Omega_R sufficient,TBD,TBD,TBD,TBD,TBD,TBD,TBD,P_mw ASSUMED; cable loss not measured at base. ΔT_mw marginal (100 vs 104 µK).,Directional coupler + Rabi calibration in cryostat,DESIGN_SPECIFIED,"D8,D15,D16",MW heating exceeds budget; Rabi undefined,NO,
I004,He-3 dosing line ↔ sample chamber,Gas delivery / chamber,Controlled He-3 dose → surface coverage,D,Isolated line; no CH4 cross-contamination; dose rate calibrated,TBD,TBD,TBD,TBD,TBD,TBD,TBD,PMB not installed; dose calibration not done; line not fabricated,Install PMB; calibrate flux; RGA verify isolation,DESIGN_SPECIFIED,"D11,E07",He-3 dose unknown or contaminated,NO,
I005,3He sensing line isolation ↔ 4He reference line,Gas delivery,Isotope-specific line isolation,D,No dead volume shared; zero cross-contamination,TBD,TBD,TBD,TBD,TBD,TBD,TBD,Lines not fabricated; isolation not verified,Install; leak test; RGA verify each line independently,DESIGN_SPECIFIED,D13,Isotope contrast invalid,NO,
I006,4He reference line ↔ sample chamber,Gas delivery / chamber,Controlled He-4 dose for isotope contrast,D,Clean He-4 delivery; no He-3 residual from prior dose,TBD,TBD,TBD,TBD,TBD,TBD,TBD,Line not fabricated; purge protocol undefined,Install; test purge between isotopes,DESIGN_SPECIFIED,D13,No control experiment,NO,
I007,CH4/process line ↔ Mode B chamber,Gas delivery / Mode B,LCVD precursor delivery,A,Mode B only; complete isolation from sensing path,TBD,TBD,TBD,TBD,TBD,TBD,TBD,Line not fabricated; backstreaming risk,Install check valves; IL-02 interlock; RGA post-Mode B,DESIGN_SPECIFIED,"D2,A4",Precursor contaminates Mode D,NO,
I008,Purge line ↔ sample chamber,Gas delivery / Mode B,Pump out CH4 after Mode B,C,Effective purge to P_CH4 < 5e-12 Pa before Mode C,TBD,TBD,TBD,TBD,TBD,TBD,TBD,Purge efficiency undefined; pumpout time unknown,RGA post-purge; define time criterion,DESIGN_SPECIFIED,"B1,D2",CH4 residual in Mode D,NO,
I009,Pumpout/dump path ↔ chamber,Vacuum system,Emergency gas dump; controlled pump-down,B/C,Safe dump path for all process gases,TBD,TBD,TBD,TBD,TBD,TBD,TBD,Path not specified,Define and install dump path,DESIGN_SPECIFIED,B1,Gas trapped in chamber,NO,
I010,Cryo-baffle/PMB ↔ sample line-of-sight,Helium dosing,Controlled He isotope exposure,D,Clear line-of-sight for PMB; shutter control; thermal isolation,TBD,TBD,TBD,TBD,TBD,TBD,TBD,Not installed; thermal load from baffle unmeasured,Install; measure baffle T and thermal load to sample,DESIGN_SPECIFIED,"D11,E08",Dose uncontrolled; unexpected heat load,NO,
I011,QCM ↔ dose/coverage proxy,Diagnostics,Frequency shift → coverage estimate,B/D,QCM adjacent to sample; sub-0.1 Hz noise floor; drift separated from signal,TBD,TBD,TBD,TBD,TBD,TBD,TBD,Not installed; noise floor UNVERIFIED under cryogenic conditions; placement uncertain,Install; measure cryogenic noise floor; calibrate vs known coverage,DESIGN_SPECIFIED,"B5,D11",Coverage inference unavailable or unreliable,NO,He-3 shift ≈0.09 Hz requires sub-0.1 Hz stability
I012,Ag sinter ↔ diamond/sample thermal node,Thermal interface,Heat conduction sample→MC via G_eff,D,G_eff >= 8.6e-6 W/K; good thermal contact over 45 cm2,TBD,TBD,TBD,TBD,TBD,TBD,TBD,Sinter not fabricated; G_eff ASSUMED; actual alpha_K and area uncertain,Fabricate; step-response thermometry,DESIGN_SPECIFIED,"D5,E05",T_sample exceeds budget,NO,
I013,Kevlar/G-10 support ↔ thermal intercepts,Support / thermal,Mechanical support with thermal isolation,ALL,Thermal interception at 4K/1K/100mK/10mK; heat load < budget,TBD,TBD,TBD,TBD,TBD,TBD,TBD,Support not fabricated; heat load ASSUMED,Fabricate; step-response per stage,DESIGN_SPECIFIED,"D3,E06",Heat load exceeds budget,NO,Vespel SP-22 REJECTED. Kevlar/G-10CR committed.
I014,Vibration isolation ↔ sample stage,Mechanical,Attenuate pulse-tube vibration at sample,ALL,S_vib < 1e-8 m2/Hz at sample; eddy-current or bellows damping,TBD,TBD,TBD,TBD,TBD,TBD,TBD,S_vib MANUFACTURER_SPEC; not measured at NV position,Install accelerometer at cold stage; measure PSD,DESIGN_SPECIFIED,"D17,D18",Dephasing exceeds mode-local secondary load bound,NO,
I015,RGA ↔ residual gas verification,Vacuum diagnostics,Species-resolved pressure; FC correction,B,All-species scan; FC correction for sensing-surface geometry; sensitivity < 5e-12 Pa,TBD,TBD,TBD,TBD,TBD,TBD,TBD,NOT INSTALLED; FC correction factor unknown for this geometry,Install RGA; calibrate FC factor; perform all-species scan,NOT_INSTALLED,"B3,D2,E04","D10a,D10b, B3, D2 all gated on RGA",NO,FC correction critical: sensing-surface P ~100x gauge reading
I016,Interlock controller ↔ valves/lasers/MW,Control system,Hardware mode separation enforcement,ALL,Fail-safe; hardwired; IL-01 prevents LCVD+sensing overlap; IL-02 prevents CH4+He-3 concurrent opening,TBD,TBD,TBD,TBD,TBD,TBD,TBD,NOT INSTALLED or tested; mode separation currently architectural only,Install; test each interlock independently; verify mode transitions,NOT_INSTALLED,"A4,A5,D1,D2",Mode overlap → thermal overload or contamination,NO,
I017,Bakeout/NEG/cryotrap ↔ H2 suppression,Vacuum system,H2 below threshold after implementation,B,P_H2 < 5e-12 Pa; theta_H2 < 0.1% after full implementation,TBD,TBD,TBD,TBD,TBD,TBD,TBD,Bakeout NOT EXECUTED; NEG NOT INSTALLED; cryotrap NOT INSTALLED,Execute bakeout; install NEG + cryotrap; RGA verify,NOT_INSTALLED,"D10a,D10b,E01,E02,E03",D10a BLOCKED; theta_H2=0.32% (above limit),NO,
I018,Independent gas lines ↔ contamination isolation,Gas delivery,No cross-contamination between gas species,ALL,Zero shared dead volume; verified leak rate < 1e-10 Pa m3/s,TBD,TBD,TBD,TBD,TBD,TBD,TBD,Lines not fabricated; leak rates unknown,Fabricate; leak test; RGA verify each independently,DESIGN_SPECIFIED,"D11,D2,A4",Cross-contamination between gas species,NO,
I019,Surface termination ↔ helium adsorption model,Diamond / He-3 physics,F-termination determines sticking and tau_c,D,XPS-verified >95% F coverage; correlated with tau_c measurement,TBD,TBD,TBD,TBD,TBD,TBD,TBD,Termination specified but not verified; XPS not done; tau_c on F-diamond UNKNOWN,XPS + AFM post-termination; He-3 Ramsey to measure tau_c,DESIGN_SPECIFIED,"D11,D13",tau_c and n_s differ from assumption; model invalid,NO,
I020,Pockels cell/pulse picker ↔ fs pulse control,Mode B optics,Individual 100 fs pulse gating,A,Switching time < 1 ns; compatible with 1 MHz rep rate,TBD,TBD,TBD,TBD,TBD,TBD,TBD,Not installed; AOM CANNOT gate fs pulses (mismatch),Install Pockels cell; test at operating rep rate,DESIGN_SPECIFIED,D7,Pulse energy uncontrolled,NO,AOM switching time incompatible with 100 fs pulses
I021,AOM ↔ fs pulse gating (MISMATCH),Mode B optics / AOM,REJECTED_DESIGN — AOM cannot gate 100 fs pulses,A,Switching time < 1 ns required,TBD,TBD,TBD,TBD,TBD,TBD,TBD,AOM switching ~100 ns CANNOT gate 100 fs pulses,Replace with Pockels cell (BOM B023),DESIGN_SPECIFIED (REJECTED element),D7,Pulse energy uncontrolled,NO,Replace with Pockels cell. Do not use AOM for fs pulse gating. [intended_function normalized from KNOWN MISMATCH]
I022,Thermal sensors ↔ sample temperature model,Diagnostics / thermal,Real-time T_sample measurement,ALL,RuO2 calibrated; reading agrees with step-response model,TBD,TBD,TBD,TBD,TBD,TBD,TBD,Sensors not installed; calibration not done,Install RuO2; calibrate vs NIST-traceable standard,DESIGN_SPECIFIED,"D4,C3",T_sample monitoring unavailable; model unvalidated,NO,
I023,Heater ↔ step-response G_eff measurement,Diagnostics / thermal,Inject known power; measure ΔT_sample → G_eff,D,Known heater power; stable T_sample baseline; sensitive thermometry,TBD,TBD,TBD,TBD,TBD,TBD,TBD,Heater not installed; G_eff measurement protocol not defined,Install heater; define protocol; execute step-response,DESIGN_SPECIFIED,"D5,E05",G_eff remains ASSUMED,NO,
I024,Microwave attenuation chain ↔ heat load model,MW / thermal,Thermal noise and MW power attenuation,D,Each attenuator thermally anchored; total attenuation ≥40 dB from room T to 10 mK,TBD,TBD,TBD,TBD,TBD,TBD,TBD,Chain not installed; attenuation and heat load ASSUMED,Install; measure attenuation; verify heat load at each stage,DESIGN_SPECIFIED,D16,MW heating from thermal noise; delivery power wrong,NO,
I025,Cryogenic wiring ↔ conductive heat load model,Electrical / thermal,DC + signal wiring with thermal anchor,ALL,Heat load < 10 nW total,TBD,TBD,TBD,TBD,TBD,TBD,TBD,P_cond=2.46 nW [ASSUMED]; actual wiring heat load not measured,Install all wiring; measure heat load via step-response,DESIGN_SPECIFIED,"D3,D4",Thermal budget exceeded,NO,
I026,LCVD process gases ↔ residual gas memory,Vacuum / Mode B,No CH4 memory effect after Mode B,B,P_CH4 < 5e-14 Pa (FC-corrected) after purge,TBD,TBD,TBD,TBD,TBD,TBD,TBD,Memory effects duration unknown; purge efficiency unknown,RGA post-Mode B cycle; define purge time criterion,DESIGN_SPECIFIED,"D2,B1",CH4 contaminates Mode D,NO,
I027,Mode B ↔ Mode C transition,Mode control,Safe handoff from LCVD to purge,A→B,LCVD laser off; precursor valves closed; purge begins within defined time,TBD,TBD,TBD,TBD,TBD,TBD,TBD,Transition protocol not defined; interlocks not installed,Define protocol; install interlocks; test transition,DESIGN_SPECIFIED,"D1,B1",CH4 residual in Mode D,NO,
I028,Mode B ↔ Mode C transition,Mode control,Safe handoff from purge to recooling,B→C,P_CH4 < threshold by RGA; heat switch command sent,TBD,TBD,TBD,TBD,TBD,TBD,TBD,RGA not installed; transition criteria not defined,Install RGA; define RGA-based transition criterion,DESIGN_SPECIFIED,"C1,D2",Premature recooling with contamination,NO,
I029,Mode C ↔ Mode D transition,Mode control,Safe handoff from recooling to sensing,C→D,T_sample recovered to < 10.5 mK; residual gas stable; He-3 line ready,TBD,TBD,TBD,TBD,TBD,TBD,TBD,T_sample monitoring not installed; criteria not defined,Install sensors; define T + P stability criteria,DESIGN_SPECIFIED,"C3,D4",Sensing starts with drift artifact,NO,
I030,Mode D sensing ↔ helium isotope dose state,Mode D / gas,He-3 or He-4 dose controlled during sensing,D,Dose rate stable; isotope isolated; no CH4 residual,TBD,TBD,TBD,TBD,TBD,TBD,TBD,PMB not installed; dose rate unknown; isolation unverified,Install PMB; calibrate; test isolation,DESIGN_SPECIFIED,"D11,D13",Dose unknown; contamination risk,NO,
I031,QCM thermal drift ↔ mass-loading inference,Diagnostics,Separate thermal drift from He-3 mass signal,D,Drift < 0.05 Hz/K; signal >> drift over dose time,TBD,TBD,TBD,TBD,TBD,TBD,TBD,Drift rate under cryogenic conditions UNKNOWN,Cryogenic QCM drift test,DESIGN_SPECIFIED,"B5,D11",Cannot distinguish dose from thermal artifact,NO,
I032,PMB dose calibration ↔ surface coverage model,Helium dosing / model,Relate PMB parameters to surface coverage,D,Flux calibrated via pressure rise or QCM reference experiment,TBD,TBD,TBD,TBD,TBD,TBD,TBD,PMB not installed; flux UNKNOWN; calibration not done,Install PMB; calibrate flux vs pressure,DESIGN_SPECIFIED,D11,Coverage model disconnected from reality,NO,
I033,Cryo-baffle thermal load ↔ sample heat budget,Thermal / dosing,Baffle radiation load bounded within Mode D budget,D,Baffle radiation < 1 nW at sample,TBD,TBD,TBD,TBD,TBD,TBD,TBD,Baffle not installed; thermal load UNKNOWN,Install; measure baffle temperature and radiation to sample,DESIGN_SPECIFIED,D3,Thermal budget exceeded,NO,
I034,Surface characterization ↔ termination assumptions,Diamond / model,XPS/AFM results constrain adsorption model,D,XPS > 95% F coverage; AFM shows atomically flat surface; Raman confirms sp3,TBD,TBD,TBD,TBD,TBD,TBD,TBD,Characterization not done; termination assumed,XPS + AFM + Raman post-termination,DESIGN_SPECIFIED,"D11,D13",tau_c model invalid if surface differs from assumption,NO,
I035,Helium isotope purity verification ↔ contrast interpretation,Gas quality / NV physics,Verified purity enables unambiguous isotope contrast,D,He-3 >99.9%; He-4 >99.9%; RGA-verified before use,TBD,TBD,TBD,TBD,TBD,TBD,TBD,Purity not verified; isotope contamination would dilute contrast,RGA or mass-spec of both cylinders before use,DESIGN_SPECIFIED,D13,ΔΓ diluted; nuclear spin hypothesis undermined,NO,
I036,Kevlar end clamps ↔ anchor blocks,Support architecture / thermal intercepts,Secure fiber; transmit tension; conduct heat to intercept,ALL,No slip after 10 thermal cycles; contact resistance < TBD,4K anchor block,10mK anchor block,"4K,1K,100mK,10mK",Crimped/epoxied to fiber; bolted to anchor block,Fiber → clamp body → anchor block → stage plate,Clamp stiffness couples fiber vibration,None,Differential thermal contraction pulls fiber through clamp (slip risk),Slip test at cryogenic T after 10 cycles,DESIGN_SPECIFIED,"D3,E06",Fiber slips → sample falls,NO,Kevlar clamp slip is a critical safety item. Design TBD.
I037,G-10CR flexure mounts ↔ sample-stage frame,Support architecture / sample stage,Attach flexures to frame and stage; lateral compliance,ALL,Attachment stable after 10 thermal cycles; stiffness per design,Warm frame connection,Cold stage connection,N/A,Bolded or adhesive-bonded,G-10CR conduction through mount,Mount transmits lateral vibration,None,Adhesive failure at cryogenic T; mount loosening from differential contraction,Torque-retention test after 10 cycles; alignment check,DESIGN_SPECIFIED,"D3,E06",Lateral drift; heat load increase,NO,G-10CR attachment stability UNKNOWN
I038,OFHC thermal intercept clamps ↔ staged thermal anchors,Support / thermal management,Thermalize Kevlar fiber at each stage,ALL,Contact resistance < TBD at each stage; heat load within budget,Each warmer stage plate,Each colder stage plate,"Staged (4K,1K,100mK,10mK)",Clamped around fiber; bolted to stage plate,OFHC Cu → stage plate → dilution refrigerator,Rigid clamp body,None,Contact resistance too high (no gold plating; dirty surface),Contact-resistance measurement per stage; step-response,DESIGN_SPECIFIED,"D3,E06",Interception fails; heat load bypasses stages,NO,Gold-plated contact faces [DESIGN_SPECIFIED]
I039,Gold-plated copper anchor blocks ↔ support network,Support / thermal management,Low-resistance thermal interface between fiber and stage,ALL,Contact resistance < TBD per block,Warmer intercept plate,Colder intercept plate,Staged,Bolted/clamped to intercept plate; gold-plated mating faces,OFHC Cu block → intercept plate,Rigid,None,Contact resistance too high; surface contamination on gold plate,Contact-resistance measurement,DESIGN_SPECIFIED,D3,Intercept conductance degraded,NO,[DESIGN_SPECIFIED]
I040,Sample-stage mounting plate ↔ diamond sample,Diamond / sample stage,"Provide rigid, thermally conductive platform for diamond",D,Good thermal contact; alignment within 10 µm,MC anchor interface (10mK),Diamond sample (10mK),N/A,Diamond bonded/clamped to plate; plate bolted to anchor,Plate → anchor interface → MC,Plate stiffness,None,Thermal gap between diamond and plate (poor bond); alignment drift,Thermal-contact test (step-response); alignment check after cooldown,DESIGN_SPECIFIED,"D4,D5",Diamond thermally decoupled; T_sample undefined,NO,Diamond-to-plate bond quality [DESIGN_SPECIFIED; UNKNOWN]
I041,Mixing-chamber anchor interface ↔ sample thermal bus,Thermal management / MC,Hard thermal anchor from sample bus to MC,D,Contact resistance << G_eff^-1; gold-plated faces,MC flange (10mK),Sample-stage plate (10mK),N/A,Bolted to MC flange; gold-plated mating faces,OFHC Cu → MC flange,Through bolted joint,None,Interface resistance degrades G_eff,Step-response measurement with interface installed,DESIGN_SPECIFIED,D5,G_eff reduced by interface resistance,NO,MC anchor interface contact resistance [DESIGN_SPECIFIED; UNKNOWN]
I042,Gas-line thermal anchors ↔ cryogenic stages,Gas delivery / thermal management,Thermalize gas lines to prevent heat leak,ALL,"Heat load reduction per design; anchored at 4K,1K,100mK,10mK",Warmer stage,Colder stage,"4K,1K,100mK,10mK",Clamps bolted to each stage plate,Line → clamp → stage plate,Through clamp body,None,Insufficient clamping contact; line vibration couples to chamber,Step-response with gas lines installed,DESIGN_SPECIFIED,D3,Gas-line heat load uncontrolled,NO,Gas-line thermal anchor effectiveness [DESIGN_SPECIFIED; UNKNOWN]
I043,Wire thermal anchors ↔ cryogenic wiring,Electrical / thermal management,Reduce DC/signal wire heat load to MC,ALL,P_cond < 10 nW total after anchoring,Room-T feedthrough,10mK component,"4K,1K,100mK intercepts",Clamped to each stage plate,Wire → clamp → stage plate,Through clamp,None,Insufficient clamping; high contact resistance in clamp,Step-response: P_cond with and without anchors,DESIGN_SPECIFIED,D3,Wire heat load exceeds budget,NO,Wire thermal anchoring effectiveness [DESIGN_SPECIFIED; UNKNOWN]
I044,Microwave-line thermal anchors ↔ CPW feed,Microwave / thermal management,Thermalize coax outer conductor at each stage,D,Total MW-line heat load < TBD nW; attenuation per design,Room-T feedthrough,10mK CPW,"4K,1K,100mK attenuators",Attenuators + clamps at each stage plate,Coax outer conductor → attenuator → stage plate,Through coax body,None,Insufficient attenuation; thermal noise from room T,MW line heat load measurement; S-parameter verification,DESIGN_SPECIFIED,D16,MW heating exceeds budget,NO,MW-line thermal anchor effectiveness [DESIGN_SPECIFIED; UNKNOWN]
I045,Optical access / window / feedthrough mount ↔ beam alignment,Optics / cryostat,Laser beam delivery through cryostat boundary,A/D,Beam alignment < 10 µm drift after cooldown; viewport heat load < 1 nW,Room-T viewport flange,Cryogenic interior,Viewport body (thermal mass),Bolted to cryostat flange; antireflection coated,Viewport thermal load (radiation),Rigid mount,None (photons),Viewport radiation heat load; beam misalignment after cooldown,Viewport heat-load measurement; beam alignment check post-cooldown,DESIGN_SPECIFIED,"D6,D7,D14",Beam blocked; excess heat load,NO,Viewport radiation load [DESIGN_SPECIFIED; not measured]
I046,QCM mount ↔ chamber mechanical reference,Diagnostics / chamber,Stable QCM position relative to sample,B/D,QCM position stable to < 1 mm; vibration decoupled from sample,Chamber wall (4K or warmer),QCM crystal,TBD,Bolted to chamber wall,Through mount body,Chamber wall vibration → QCM,None,Vibration coupling from chamber to QCM → frequency noise,QCM vibration noise test; frequency stability at operating T,DESIGN_SPECIFIED,"B5,D11",QCM drifts from vibration,NO,QCM vibration decoupling [DESIGN_SPECIFIED; UNKNOWN]
I047,PMB mount ↔ line-of-sight geometry,Helium dosing / chamber,PMB aligned to sample; stable geometry,D,Line-of-sight from PMB nozzle to sample within ±5°; position stable after cooldown,Chamber flange (room T),PMB nozzle (cryogenic),TBD,Flanged to chamber,Through mount body,Chamber vibration,He-3 gas path,Cooldown misalignment of PMB relative to sample,Geometry verification post-cooldown; flux calibration,DESIGN_SPECIFIED,D11,Dose misses sample,NO,[DESIGN_SPECIFIED]
I048,Cryo-baffle mount ↔ shuttered isolation geometry,Helium dosing / chamber,Baffle mounted for effective line-of-sight shielding,D,Shutter covers full solid angle from PMB to sample; stable after cooldown,Chamber wall,Baffle body (cryogenic),TBD,Bolted to chamber wall,Through mount body,Chamber vibration,None,Shutter misalignment after cooldown,Geometry verification; shutter timing test at cryogenic T,DESIGN_SPECIFIED,D11,Baffle does not shield sample correctly,NO,[DESIGN_SPECIFIED]
I049,Vibration sensor mount ↔ sample-stage PSD measurement,Diagnostics / vibration,Sensor at correct location to measure sample-stage PSD,ALL,Sensor at sample-stage node or co-located within 10 mm,Chamber wall or sample stage,Sensor body,TBD,Bolted to measurement point; rigid mount,Through mount body,Sensor stiffness,None,Sensor at wrong location → biased PSD reading,Verify sensor location; compare to accelerometer at MC flange,DESIGN_SPECIFIED,D17,S_vib unrepresentative of NV position,NO,[DESIGN_SPECIFIED]
I050,Temperature sensor mount ↔ true sample node,Diagnostics / thermal,Sensor at diamond/sample thermal node (not frame),ALL,Sensor thermal resistance to sample < G_eff/100,Sample stage (10mK),Sensor body,N/A,Epoxied or bolted to sample stage at diamond thermal node,Sensor body → sample stage,Through mount,None,"Sensor at frame → reads frame T, not sample T","Dual-sensor test: one at sample, one at frame; compare readings",DESIGN_SPECIFIED,D4,T_sample reading biased; G_eff measurement wrong,NO,Sensor placement at true thermal node is critical for step-response validity
I051,Mode B LCVD laser ↔ precursor beam path,Mode B optics / precursor delivery,Photolysis/pyrolysis at target,A,Beam coincident with PMB precursor at sample,Optical bench (room T),Growth zone (cryogenic),"TBD (viewport, intercepts)",Optical mount on bench,Free-space through viewport,None (optical),None,Beam-precursor misalignment; cryocondensation upstream of target,Beam alignment + condensation map by witness coupon,DESIGN_SPECIFIED,"A6,A8",LCVD does not occur at target,NO,Mode B LCVD interface; separate from Mode D optics.
I052,Growth thermal dump switch ↔ 1K/4K dump stage,Mode B thermal dump,Absorb Mode B (growth) heat away from MC,A,G_growth_to_dump >> G_growth_to_MC_leak,4K plate or 1K plate,Growth-stage carrier,N/A,Heat switch + bolted thermal link,Switch closed in Mode A; OFHC Cu link,Through switch body,None,Insufficient G_growth_to_dump → MC heats during Mode B,Step-response per dump path,NOT_INSTALLED,A12,MC heat leak exceeds budget during Mode B,NO,New hardware required for Mode B. NOT_INSTALLED.
I053,Radiation shutter stack ↔ 10mK region,Mode B thermal protection,Block radiation from growth zone to 10mK,A,Shutter closed during Mode B; transmission < TBD,Mechanism actuator (warm),10 mK region,"4K, 1K stages",Bolted shutter mount,Shutter body absorbs/reflects,Actuator vibration to chamber,None,Shutter leak; vibration coupling; actuator wear,Radiation transmission test + vibration PSD with shutter cycling,NOT_INSTALLED,A12,10mK region heated by growth radiation,NO,New hardware required for Mode B. NOT_INSTALLED.
I054,Growth-zone thermometry ↔ Mode B thermal solve,Mode B diagnostics,"Real-time T_growth, T_MC, T_dump during Mode B",A,"Sensors at growth surface, sample bulk, MC, 1K, 4K stages",Bridge electronics (room T),Sample stage / growth zone,Each cryogenic stage,Bolted/epoxied at each location,Wire conduction (anchored),Through mount,None,Sensor at wrong node; wire heat load uncontrolled,Calibration vs NIST-traceable; sensor placement verification,NOT_INSTALLED,"A8,A12",Cannot validate Mode B thermal solve,NO,New hardware required for Mode B.
I055,Witness coupon (sensing zone) ↔ Mode B contamination audit,Diagnostics / sample,Post-Mode-A contamination characterization,A,Coupon in sensing zone receives same gas environment as sample,Loadlock or in-situ transfer,Sensing-zone position,TBD,Loadlock or in-situ holder,N/A (post-cycle removal for ex-situ),Coupon vibration,Post-Mode-A coupon transport,Coupon contaminated during transfer; not representative,"Coupon characterization (AFM, Raman, XPS) post-cycle",NOT_INSTALLED,"A9,A10",Cannot quantify cross-contamination,NO,New hardware required for Mode B.
I056,IL-14 LCVD/helium hardware interlock,Control system / safety,Forbid LCVD_on AND helium_present,A/D,Hardwired interlock; fail-safe; testable,Interlock controller (room T),Valve actuators + laser shutter,N/A,Wired to interlock controller,Electrical,None,None,Interlock failure allows He during LCVD,Interlock test: assert IMPOSSIBLE state cannot be reached,NOT_INSTALLED,A14,He present during LCVD; LCVD chemistry corrupted,NO,IL-14: LCVD_on AND helium_film_present = IMPOSSIBLE.
I057,radiation shutter stack <-> 10 mK sample region,SHIELD-001/002/003 / 10 mK stage,closed radiation barrier with measured leakage budget,D,shutter must close cleanly; leakage measured,,,,,,,,,Radiometric sample-stage heat load with shutter closed; baffle thermometry,BLOCKED,Shield-RAD; C4,Mode D blocked until measured,NO,added by shielding/mode-separation hardening pass
I058,RF-tight sample can <-> coax/microwave filters,SHIELD-004 / SHIELD-005,filters terminate inside RF-tight enclosure,D,all penetrations thermally anchored; RF integrity verified,,,,,,,,,Closed-can vs open-can NV baseline; RF noise floor at NV frequencies,BLOCKED,Shield-RF,Mode D blocked until measured,NO,added by shielding/mode-separation hardening pass
I059,IR/HF filters <-> thermal anchors,SHIELD-005 / cryogenic stages,staged anchoring at 50 K/4 K/1 K/100 mK/10 mK,D,each filter body at its assigned stage temperature,,,,,,,,,Per-stage filter-body thermometry during RF operation,BLOCKED,Shield-RF,Mode D blocked until measured,NO,added by shielding/mode-separation hardening pass
