interface_id,interface,subsystems,intended_function,mode,required_compatibility,warm_side_anchor,cold_side_anchor,intermediate_thermal_intercepts,mechanical_attachment,thermal_path,vibration_path,contamination_path,possible_mismatch,measurement_required,status,gate_impact,failure_consequence,can_PASS_now,notes
I060,optical apertures <-> cold beam dumps,SHIELD-006 / SHIELD-007,aperture chain feeds beam dump at higher-capacity stage,D,no overflow to 10 mK stage; LOS verified,,,,,,,,,Per-stage beam-dump absorbed-power measurement; LOS audit,BLOCKED,Shield-OPT,Mode D blocked until measured,NO,added by shielding/mode-separation hardening pass
I061,dirty process shutter <-> sacrificial cryopanel,SHIELD-008 / SHIELD-009,two-zone shutter with cryopanel between dirty and clean sides,B-C,sacrificial panel captures Mode B residue before clean shutter,,,,,,,,,Clean-side coupon after repeated Mode B exposures; QCM tracking,BLOCKED,Shield-CHEM,Mode D blocked until measured,NO,added by shielding/mode-separation hardening pass
I062,clean sensing shutter <-> Mode D sensing volume,SHIELD-008 clean half / Mode D volume,final barrier protecting Mode D region,D,clean side must remain within Mode D contamination spec,,,,,,,,,Witness coupon on clean side; RGA at Mode D entry,BLOCKED,Shield-CHEM; C_to_D_Readiness,Mode D blocked until measured,NO,added by shielding/mode-separation hardening pass
I063,magnetic shield <-> NV bias coils,SHIELD-010 / NV bias geometry,shield must preserve calibrated NV bias-field geometry,D,noise reduced; bias stable; ODMR-compatible,,,,,,,,,Field map with shield in/out; NV ODMR baseline before/after,BLOCKED,Shield-MAG,Mode D blocked until measured,NO,added by shielding/mode-separation hardening pass
I064,superconducting shield <-> cooldown field history,SHIELD-011 (optional) / cooldown sequence,controlled-field cooldown; trapped-flux mapped before adoption,D (optional),no trapped flux above NV bias tolerance,,,,,,,,,Controlled-field cooldown; trapped-flux assessment,BLOCKED,Shield-MAG,Mode D blocked until measured,NO,added by shielding/mode-separation hardening pass
I065,cryo-baffles <-> Mode C recovery,SHIELD-002 / Mode C sequence,baffles capture residual species during Mode C purge,C,capture efficiency measured by witness coupon and RGA,,,,,,,,,Witness coupon and RGA after Mode B exposure,BLOCKED,Shield-CHEM; C_to_D_Readiness,Mode D blocked until measured,NO,added by shielding/mode-separation hardening pass
I066,cryopanels <-> RGA/QCM/witness-coupon validation,SHIELD-009 + PANEL-* / instrumentation,panel performance verified by species-resolved RGA + QCM + coupon analysis,C,saturation and regeneration measured,,,,,,,,,Per-species RGA + QCM through full cycle; saturation/regeneration test,BLOCKED,Shield-CHEM,Mode D blocked until measured,NO,added by shielding/mode-separation hardening pass
I067,Mode B growth region <-> Mode C purge/recovery stack,Mode B / Mode C sequence,process region feeds into purge/recovery on B->C transition,B->C,all process gas lines isolated before C-mode operations begin,,,,,,,,,mode_transition_acceptance_tests.csv row T-B2C,BLOCKED,C_to_D_Readiness,Mode D blocked until measured,NO,added by shielding/mode-separation hardening pass
I068,Mode C readiness gates <-> Mode D permission,Mode C readiness / Mode D entry,C_to_D readiness gate is the permission interlock for entering Mode D,C->D,all C->D sub-conditions satisfied before Mode D begins,,,,,,,,,mode_transition_acceptance_tests.csv row T-C2D coordinated measurement,BLOCKED,C_to_D_Readiness,Mode D blocked until measured,NO,added by shielding/mode-separation hardening pass
I069,RTB/JT module <-> 4 K shield,RTB/JT cold head / 4 K shield,Upstream cooling delivery to 4 K shield via thermal braid/strap,D / shield,thermal link conductance > spec; derated lift adequate,,,,,,,,,Per-module thermal-link conductance W/K; sample-stage heat-load delta,BLOCKED,RTB_JT_OPTIONAL_COOLING_PLANT; Shield-RAD,RTB/JT DESIGN_OPTION blocked until measured integration data exists,NO,added by RTB/JT optional-cooling-plant pass; DESIGN_OPTION only
I070,RTB/JT module <-> cryobaffle,RTB/JT cold head / SHIELD-002 cryobaffle,Upstream cooling delivery to cryogenic baffle stage,D / shield,baffle temperature within spec; total load within stage capacity,,,,,,,,,Baffle thermometry with RTB/JT operating,BLOCKED,RTB_JT_OPTIONAL_COOLING_PLANT; Shield-RAD,RTB/JT DESIGN_OPTION blocked until measured integration data exists,NO,added by RTB/JT optional-cooling-plant pass; DESIGN_OPTION only
I071,RTB/JT module <-> Mode B growth heat-dump stage,RTB/JT cold head / Mode B growth heat-dump,Upstream cooling delivery to Mode B growth heat-dump stage,A,Mode B growth heat-dump-stage temperature recovers within Mode B cadence,,,,,,,,,Dump-stage temperature trace through Mode A->B cycle with RTB/JT operating,BLOCKED,RTB_JT_OPTIONAL_COOLING_PLANT,RTB/JT DESIGN_OPTION blocked until measured integration data exists,NO,added by RTB/JT optional-cooling-plant pass; DESIGN_OPTION only
I072,RTB/JT controller <-> EMI/RF budget,RTB/JT controller / EMI envelope,Controller drive electronics must not exceed EMI budget at NV/microwave frequencies,D,EMI noise floor at NV readout and microwave-drive bandwidths within budget,,,,,,,,,EMI measurement against NV/microwave/readout chain,BLOCKED,RTB_JT_OPTIONAL_COOLING_PLANT; Shield-RF,RTB/JT DESIGN_OPTION blocked until measured integration data exists,NO,added by RTB/JT optional-cooling-plant pass; DESIGN_OPTION only
I073,RTB/JT mechanical mount <-> vibration isolation,RTB/JT compressor mount / vibration isolation stack,Mechanical mount routes compressor/turbine vibration through isolation stage,D,vibration spectrum at sample stage within Mode D threshold,,,,,,,,,"Vibration PSD at sample stage, optical path, and NV interface",BLOCKED,RTB_JT_OPTIONAL_COOLING_PLANT; vibration gates,RTB/JT DESIGN_OPTION blocked until measured integration data exists,NO,added by RTB/JT optional-cooling-plant pass; DESIGN_OPTION only
I074,RTB/JT thermal rejection <-> facility/environment,RTB/JT compressor / facility,Heat rejection to facility chilled water or air; site envelope must accommodate,A/D (both),facility heat-rejection envelope sized for full RTB/JT load,,,,,,,,,Vendor electrical + thermal rejection data; facility load measurement,BLOCKED,RTB_JT_OPTIONAL_COOLING_PLANT,RTB/JT DESIGN_OPTION blocked until measured integration data exists,NO,added by RTB/JT optional-cooling-plant pass; DESIGN_OPTION only
I075,RTB/JT operation <-> Mode D readiness gate,RTB/JT plant / C_to_D readiness,Mode D entry requires demonstrated isolation against RTB/JT thermal/vibration/RF/optical signatures,C->D,NV ODMR/Ramsey baseline equivalent with RTB/JT on vs off,,,,,,,,,Mode D baseline measurement with RTB/JT operating,BLOCKED,C_to_D_Readiness; RTB_JT_OPTIONAL_COOLING_PLANT,RTB/JT DESIGN_OPTION blocked until measured integration data exists,NO,added by RTB/JT optional-cooling-plant pass; DESIGN_OPTION only
