path_id,source,mode_active,direct_line_of_sight_to_10mK,intercept_stage,aperture_stage,beam_dump_stage,risk,required_measurement,validation_status,can_PASS_now
LOS-001,NV readout/excitation laser (532 nm or near-IR),Mode D,YES (required by design — must be controlled by aperture chain not blocked),NV objective at base stage,50 K and 1 K cold apertures,4 K cold beam dump for stray reflections,Stray NV-readout light heats the sample stage and increases scattered photon floor at NV detector,Optical-power measurement at each cold aperture; sample-stage heating with laser on/off; NV detector noise floor with readout on/off,BLOCKED,NO
LOS-002,fs-laser Mode B processing beam,Mode B only (must be blocked during Mode D),NO (blocked by closed shutter during Mode D),three-shutter stack (closed in Mode D),50 K and 4 K cold apertures,4 K cold beam dump,fs-laser scatter memory persisting into Mode D after Mode C recovery; window contamination,Shutter-closed leakage test; line-of-sight audit during Mode B-to-D transition; scattered light at sample stage,BLOCKED,NO
LOS-003,room-temperature optical access window,Mode A and Mode D (always present),Limited (mitigated by aperture chain),warm baffle + 50 K aperture,50 K and 4 K and 1 K cold apertures,4 K cold beam dump (stray ambient),Ambient 300 K light entering through the access window and reaching the mK region,Closed-room measurement with shutters open and closed; sample-stage heat load; baffle thermometry,BLOCKED,NO
LOS-004,internal optical feedthrough / fiber feedthrough,Mode A and Mode D,Depends on fiber/feedthrough geometry,thermal anchoring at every stage,buffer fiber routing through 4 K and 1 K,fiber-tip beam dump where unused,Blackbody leakage along uncoated fiber; back-reflected NV light into detection chain,Feedthrough thermometry; sample-stage heating with feedthrough installed vs blanked,BLOCKED,NO
LOS-005,scattered/reflected optical path from sample,Mode D (NV readout in progress),YES (intentional — return path),collection optics at base stage,cold filter / spectral filter near collection,4 K stage for stray scatter,Scatter from sample surface or sample mount re-entering the warm side and re-scattering back as background,Background-photon measurement at NV detector with sample illuminated; sample-stage heat load,BLOCKED,NO
LOS-006,cold aperture chain integrity,Mode D,N/A — this is the mitigation,full chain: 50 K -> 4 K -> 1 K -> 100 mK -> sample,SHIELD-006 nested cold apertures,SHIELD-007 cold beam dumps,Aperture misalignment after cooldown contraction; clipping or scatter at apertures themselves,Cold-aligned aperture audit after cooldown; sample-stage heat load with aperture chain in place,BLOCKED,NO
